{
  "schema_version": 3,
  "task_id": "wannier90.tutorials.v3_1_0.example23",
  "title": "Wannier90 3.1.0 example23: Silicon G0W0 band interpolation",
  "status": "deferred",
  "status_detail": "Deliberately deferred inventory Task for Wannier90 3.1.0 `examples/example23`. It is not selected for execution; no workspace has been created and no command has been invoked by this Task.",
  "parent_task_id": "wannier90.tutorials.v3_1_0",
  "task_prerequisite_ids": [
    "P2",
    "quantumespresso.simulations.integration"
  ],
  "external_prerequisite_ids": [
    "local_execution_resource_authorization",
    "pseudopotential_selection_and_license",
    "qe_tutorial_execution_authorization",
    "tutorial_input_terms_accepted",
    "wannier90_tutorial_execution_authorization",
    "wannier90_tutorial_preflight_completed"
  ],
  "superseded_by_task_ids": [],
  "explicit_activation_required": true,
  "objective": "Preflight and, only after exact protected-execution authorization, execute or deliberately defer the bundled Wannier90 3.1.0 `examples/example23` tutorial on silicon g0w0 band interpolation.",
  "authority_reference_paths": [
    "docs/computational/wannier90.tutorials.v3_1_0.md"
  ],
  "authorized_scope": [
    "Inventory the exact `examples/example23` source directory: 10 files with canonical path-and-content manifest SHA-256 `d5e36cbd5cae9f757e42f62541a27c4d259f806b53f14084b71946bfa1169eef`.",
    "Inspect the tutorial inputs, required executables and interfaces, pseudopotentials or supplied matrices, terms, environment assumptions, expected cost, stage order, warnings, and output behavior without executing them.",
    "If separately authorized, copy only the exact preflighted minimum assets into a new isolated ignored run workspace and invoke only the declared bounded stage sequence without automatic retries.",
    "Retain exact source and executable identities, inputs, pseudopotential or matrix identities and terms, commands, attempts, streams, runtimes, exit states, warnings, and compact artifact inventories.",
    "Record a completed, completed-with-warning, failed, unsupported, or deliberately deferred learning disposition without automatically activating another tutorial or production work."
  ],
  "completion_criteria": [
    "The source-directory Task has an explicit evidence-backed execution or deliberate-deferral disposition.",
    "Any invocation is covered by exact protected-execution authorization and remains within its declared stage, resource, retry, and warning-handling envelope.",
    "Retained evidence distinguishes tutorial behavior from project production convergence, numerical verification, scientific validation, and human acceptance.",
    "No large native output, restart state, wavefunction, charge density, dense matrix, or mutable tutorial workspace is committed to Git."
  ],
  "exclusions": [
    "This Task record does not authorize execution, dependency installation, pseudopotential download, network access, remote computation, workspace creation, or source-tree mutation.",
    "Bundled settings and outputs do not override project specifications or become production defaults.",
    "A successful tutorial does not establish scientific correctness, cross-version equivalence, production suitability, or support for its material system.",
    "Automatic retries, successor activation, and unbounded execution are prohibited."
  ],
  "intake_path": null,
  "archived_source": null
}
