{
  "schema_version": 3,
  "task_id": "quantumespresso.simulations.qe_examples.pw.exx-example",
  "title": "QE 7.2 bundled PW EXX_example example",
  "status": "blocked",
  "status_detail": "Inventory-only Task for the bundled Quantum ESPRESSO 7.2 source group `PW/examples/EXX_example`. No script has been invoked by this Task. Exact source, executable, input, pseudopotential, dependency, resource, retention, and protected-execution preflights remain required.",
  "parent_task_id": "quantumespresso.simulations.qe_examples",
  "task_prerequisite_ids": [
    "P2",
    "quantumespresso.simulations.integration"
  ],
  "external_prerequisite_ids": [
    "bundled_example_preflight_completed",
    "local_execution_resource_authorization",
    "pseudopotential_selection_and_license",
    "qe_7_2_bundled_example_execution_authorization",
    "qe_7_2_source_identity_verified"
  ],
  "superseded_by_task_ids": [],
  "explicit_activation_required": true,
  "objective": "Preflight and, only after exact protected-execution authorization, execute or deliberately defer the Quantum ESPRESSO 7.2 bundled example group `PW/examples/EXX_example` containing `PW/examples/EXX_example/run_example`.",
  "authority_reference_paths": [
    "docs/computational/quantumespresso.simulations.qe_examples.md"
  ],
  "authorized_scope": [
    "Inventory source group `PW/examples/EXX_example` and candidate script(s): `PW/examples/EXX_example/run_example`.",
    "Inspect the script, referenced inputs, executables, pseudopotentials, downloads, environment assumptions, expected cost, and output behavior without executing it.",
    "If separately authorized, copy the minimum required assets into an isolated ignored run tree and invoke only the exact preflighted script or explicitly bounded constituent commands.",
    "Retain exact source and executable identities, inputs, pseudopotential identities and terms, commands, attempts, streams, runtimes, exit states, and compact artifact inventories.",
    "Record a completed, failed, unsupported, or deliberately deferred learning disposition without automatically activating another bundled example."
  ],
  "completion_criteria": [
    "Every candidate script in this source group has an explicit evidence-backed execution or deferral disposition.",
    "Any invocation is covered by exact protected-execution authorization and remains within its declared resource and retry envelope.",
    "Retained evidence distinguishes bundled-example behavior from project numerical verification, production convergence, scientific validation, and human acceptance.",
    "No large native output, restart state, wavefunction, charge density, dense matrix, or ambient source-tree mutation is committed to Git."
  ],
  "exclusions": [
    "This Task record does not authorize execution, dependency installation, pseudopotential download, network access, remote computation, or source-tree mutation.",
    "Bundled settings and outputs do not override project specifications or become production defaults.",
    "A successful bundled example does not establish scientific correctness, cross-version equivalence, or support for its material system.",
    "Automatic retries, successor activation, and unbounded execution are prohibited."
  ],
  "intake_path": null,
  "archived_source": null
}
