{
  "schema_version": 3,
  "task_id": "B",
  "title": "Task B — Provenance foundation",
  "status": "superseded",
  "status_detail": "prospectively superseded for workflow sequencing by P2/P3; never launched",
  "parent_task_id": null,
  "task_prerequisite_ids": [],
  "external_prerequisite_ids": [],
  "superseded_by_task_ids": [],
  "explicit_activation_required": false,
  "objective": "Implement the approved portable provenance foundation without coupling it to DFT, QE, TB, Wannier, or operators.",
  "authority_reference_paths": [
    "harness/archive/task-control-v1/tasks/B.md"
  ],
  "authorized_scope": [
    "immutable `ArtifactReference`;",
    "separately owned `ArtifactLocation` or explicit resolver contract;",
    "immutable `RunManifest`;",
    "deterministic serializers/deserializers;",
    "checksum and directory-index verification actions;",
    "structured partial, interrupted, resumed, missing, and checksum-mismatch states."
  ],
  "completion_criteria": [
    "Implementation, software-verification tests, documentation, independent read-only review, parent verification, and human acceptance are all required. Acceptance contributes to G01a and unlocks C, E, F, and H according to their remaining prerequisites; it launches none."
  ],
  "exclusions": [
    "No `logical_path_or_uri` field is permitted. Storage technology, deletion, unrestricted environment capture, production manifests, and real execution are excluded."
  ],
  "intake_path": null,
  "archived_source": {
    "path": "harness/archive/task-control-v1/tasks/B.md",
    "sha256": "49c3dd593d56607de9ff2ca88ea9ccebc9fc660e38a4947db8a997f15e57e85b"
  }
}
