{
  "schema_version": 3,
  "task_id": "migration.v2.application.composition",
  "title": "V2 application composition implementation",
  "status": "planning",
  "status_detail": "Authorized within the bounded eight-Task execution path in harness/intake/v2-execution-path-authorization.md. Planning may proceed; implementation requires actual prerequisite results and antagonistic planning reviews. Routine human-review and acceptance pauses are waived, not software verification or protected boundaries. No commit, push, or scientific execution is authorized.",
  "parent_task_id": "migration.v2.application",
  "task_prerequisite_ids": [
    "migration.v2.analysis.implementation-verification",
    "migration.v2.calculators.contract-verification",
    "migration.v2.campaigns.definitions",
    "migration.v2.harness.compiler",
    "migration.v2.harness.decisions-authority",
    "migration.v2.harness.persistence",
    "migration.v2.integration.quantumespresso.verification",
    "migration.v2.persistence.sqlite",
    "migration.v2.workflows.contract-verification"
  ],
  "external_prerequisite_ids": [],
  "superseded_by_task_ids": [],
  "explicit_activation_required": true,
  "objective": "Compose accepted Harness, persistence, Workflow, campaign, calculator, integration, and analysis implementations with explicit dependencies.",
  "authority_reference_paths": [
    "docs/architecture/migration/v1-to-v2/implementation/index.md",
    "docs/architecture/migration/v1-to-v2/index.md",
    "docs/architecture/migration/v1-to-v2/package-module-crosswalk.md",
    "docs/architecture/v2/index.md",
    "docs/architecture/v2/ksdft2effmass/application/index.md",
    "harness/intake/v2-execution-path-authorization.md"
  ],
  "authorized_scope": [
    "Plan the complete lifecycle and, only after separate explicit activation and applicable authority, implement the bounded concern: Compose accepted Harness, persistence, Workflow, campaign, calculator, integration, and analysis implementations with explicit dependencies.",
    "Keep planning, implementation planning, implementation, optional critical human decisions, verification, and administrative closeout within this Task concern.",
    "Treat parent relationships as containment only and require actual closed results for declared Task or external prerequisites before dependent implementation."
  ],
  "completion_criteria": [
    "Verified application composition with separate development and scientific stores.",
    "Applicable source, tests, documentation, compatibility findings, prerequisite results, and residual limitations agree under their owning contracts.",
    "Administrative closeout records actual results and leaves automatic successor activation disabled."
  ],
  "exclusions": [
    "The current planning phase creates no implementation, dependency change, protected execution, scientific acceptance, publication, release, or automatic successor activation.",
    "Do not move behavior outside this Task concern or use parent status, planning prose, reviewer agreement, or passing checks as prerequisite or authority facts.",
    "Do not fabricate historical WorkflowRun, calculator, validation, human-decision, or provenance state during migration."
  ],
  "intake_path": null,
  "archived_source": null
}
