{
  "schema_version": 3,
  "task_id": "migration.v2.petrinet.colored.values",
  "title": "V2 CPN values and tokens",
  "status": "closed_human_accepted_pass",
  "status_detail": "The human response `accept` supplied final acceptance of the completed generic full-name colored-Petri-net values and tokens. The accepted result owns nominal color/token identities, finite tagged values, and tokens without token-level counts; v1 routing fields have explicit dispositions and workflows.cpn remains unchanged. Focused tests, v1/v2 scalar comparisons, Ruff, mypy, Python conformance, Sphinx warnings-as-errors, dependency checks, and correction review passed. No v2 wire, protected execution, scientific claim, legacy retirement, release, or successor activation is claimed.",
  "parent_task_id": "migration.v2.petrinet.colored",
  "task_prerequisite_ids": [
    "migration.v2.identity-contracts"
  ],
  "external_prerequisite_ids": [],
  "superseded_by_task_ids": [],
  "explicit_activation_required": true,
  "objective": "Own color-qualified immutable values, tokens, scalar boundaries, identity, and represented multiplicity.",
  "authority_reference_paths": [
    "docs/architecture/migration/v1-to-v2/implementation/index.md",
    "docs/architecture/migration/v1-to-v2/implementation/petrinet/colored.md",
    "docs/architecture/migration/v1-to-v2/index.md",
    "docs/architecture/migration/v1-to-v2/package-module-crosswalk.md",
    "docs/architecture/v2/index.md"
  ],
  "authorized_scope": [
    "Plan the complete lifecycle and, only after separate explicit activation and applicable authority, implement the bounded concern: Own color-qualified immutable values, tokens, scalar boundaries, identity, and represented multiplicity.",
    "Keep planning, implementation planning, implementation, optional critical human decisions, verification, and administrative closeout within this Task concern.",
    "Treat parent relationships as containment only and require actual closed results for declared Task or external prerequisites before dependent implementation."
  ],
  "completion_criteria": [
    "Verified generic token/value contracts with explicit v1 field dispositions.",
    "Applicable source, tests, documentation, compatibility findings, prerequisite results, and residual limitations agree under their owning contracts.",
    "Administrative closeout records actual results and leaves automatic successor activation disabled."
  ],
  "exclusions": [
    "The current planning phase creates no implementation, dependency change, protected execution, scientific acceptance, publication, release, or automatic successor activation.",
    "Do not move behavior outside this Task concern or use parent status, planning prose, reviewer agreement, or passing checks as prerequisite or authority facts.",
    "Do not fabricate historical WorkflowRun, calculator, validation, human-decision, or provenance state during migration."
  ],
  "intake_path": null,
  "archived_source": null
}
