{
  "schema_version": 3,
  "task_id": "migration.v2.integration.quantumespresso",
  "title": "V2 Quantum ESPRESSO integration",
  "status": "planning",
  "status_detail": "Repository-wide v2 module-migration planning is authorized; implementation, protected execution, automatic succession, and acceptance remain unauthorized.",
  "parent_task_id": "migration.v2",
  "task_prerequisite_ids": [],
  "external_prerequisite_ids": [],
  "superseded_by_task_ids": [],
  "explicit_activation_required": true,
  "objective": "Migrate concrete QE serialization, staging, invocation, capture, parsing, discovery, failure mapping, and observation adaptation.",
  "authority_reference_paths": [
    "docs/architecture/migration/v1-to-v2/implementation/index.md",
    "docs/architecture/migration/v1-to-v2/index.md",
    "docs/architecture/migration/v1-to-v2/package-module-crosswalk.md",
    "docs/architecture/v2/index.md",
    "docs/architecture/v2/ksdft2effmass/integration/quantumespresso/index.md"
  ],
  "authorized_scope": [
    "Plan the complete lifecycle and, only after separate explicit activation and applicable authority, implement the bounded concern: Migrate concrete QE serialization, staging, invocation, capture, parsing, discovery, failure mapping, and observation adaptation.",
    "Keep planning, implementation planning, implementation, optional critical human decisions, verification, and administrative closeout within this Task concern.",
    "Treat parent relationships as containment only and require actual closed results for declared Task or external prerequisites before dependent implementation."
  ],
  "completion_criteria": [
    "A verified anti-corruption integration implementing calculator-owned contracts without scientific execution.",
    "Applicable source, tests, documentation, compatibility findings, prerequisite results, and residual limitations agree under their owning contracts.",
    "Administrative closeout records actual results and leaves automatic successor activation disabled."
  ],
  "exclusions": [
    "The current planning phase creates no implementation, dependency change, protected execution, scientific acceptance, publication, release, or automatic successor activation.",
    "Do not move behavior outside this Task concern or use parent status, planning prose, reviewer agreement, or passing checks as prerequisite or authority facts.",
    "Do not fabricate historical WorkflowRun, calculator, validation, human-decision, or provenance state during migration."
  ],
  "intake_path": null,
  "archived_source": null
}
