{
  "schema_version": 3,
  "task_id": "bulk-silicon.workflow.extracted-model-verification",
  "title": "Extracted-model workflow verification",
  "status": "blocked",
  "status_detail": "Blocked by tight-binding comparison and reduction.",
  "parent_task_id": null,
  "task_prerequisite_ids": [
    "bulk-silicon.tight-binding.comparison-reduction"
  ],
  "external_prerequisite_ids": [],
  "superseded_by_task_ids": [],
  "explicit_activation_required": true,
  "objective": "Verify the composed tutorial artifact-to-record-to-model workflow and its explicit failure boundaries.",
  "authority_reference_paths": [
    "docs/computational/ksdft2effmass.computational.bootstrap.md",
    "harness/reports/simulation-first-task-migration.md"
  ],
  "authorized_scope": [
    "Verify artifact lineage, deterministic extraction, public record round trips, fit reproducibility, Hamiltonian extraction, and comparison prerequisites.",
    "Verify represented failure, retry, partial-result, and restart behavior where implemented.",
    "Classify each retained claim as software verification, numerical verification, scientific validation, or uncertainty quantification."
  ],
  "completion_criteria": [
    "The declared software contract has focused verification.",
    "Applicable numerical checks pass or have an explicit disposition.",
    "Provenance and lineage are complete for the represented tutorial workflow.",
    "Limitations and missing evidence are explicit."
  ],
  "exclusions": [
    "This Task performs no new external calculation.",
    "Passing software tests does not establish scientific correctness.",
    "Scientific validation and uncertainty quantification require separate authorization and evidence.",
    "Completion does not activate another Task, release, or publication."
  ],
  "intake_path": null,
  "archived_source": null
}
