{
  "schema_version": 3,
  "task_id": "migration.v2.workflows.cpn-adapter",
  "title": "V2 Workflow colored-Petri-net adapter",
  "status": "closed_human_accepted_pass",
  "status_detail": "The human response `complete administrative closeout` authorized administrative closeout and constitutes final human acceptance of the completed explicit immutable Workflow-owned mapping Option B. ColoredPetriNetWorkflowMapping, WorkflowResultTokenMapping, the exact activation request, closed content-identified activation result, and ColoredPetriNetWorkflowAdapter provide effect-free direct, deterministic any_of, and compatible combined all_of adaptation to the accepted generic petrinet.colored enablement and selection contracts. Directed selection requires independent Workflow and generic-definition permission; mapping, result-token, gate, enablement, selection, and correlation defects fail closed without constructing an activation. The adapter performs no Task invocation, generic firing, marking mutation, persistence, scheduling, external effect, protected execution, scientific calculation, or scientific acceptance. Public source/API/concept and architecture documentation agree; 3499 tests, Ruff, mypy, Sphinx warnings-as-errors, Harness validation, synchronized projection integrity, and diff checks passed. Domain-specific ResultObject-to-generic-value derivation, public wire formats, WorkflowRun, firing/output adaptation, and persistence remain separate or deferred; legacy CPN retirement is separately human-accepted and closed. Automatic successor activation remains disabled. This acceptance does not establish release status or any scientific or protected-execution claim.",
  "parent_task_id": "migration.v2.workflows",
  "task_prerequisite_ids": [
    "migration.v2.petrinet.colored.contract-verification",
    "migration.v2.workflows.model"
  ],
  "external_prerequisite_ids": [],
  "superseded_by_task_ids": [],
  "explicit_activation_required": true,
  "objective": "Adapt scientific Workflow composition to accepted generic CPN semantics without introducing another dependency graph.",
  "authority_reference_paths": [
    "docs/architecture/migration/v1-to-v2/implementation/index.md",
    "docs/architecture/migration/v1-to-v2/index.md",
    "docs/architecture/migration/v1-to-v2/package-module-crosswalk.md",
    "docs/architecture/v2/index.md",
    "docs/architecture/v2/ksdft2effmass/workflows/task-and-colored-petri-net-adapter.md"
  ],
  "authorized_scope": [
    "Plan the complete lifecycle and, only after separate explicit activation and applicable authority, implement the bounded concern: Adapt scientific Workflow composition to accepted generic CPN semantics without introducing another dependency graph.",
    "Keep planning, implementation planning, implementation, optional critical human decisions, verification, and administrative closeout within this Task concern.",
    "Treat parent relationships as containment only and require actual closed results for declared Task or external prerequisites before dependent implementation."
  ],
  "completion_criteria": [
    "Verified effect-free adapter importing petrinet.colored in the accepted direction.",
    "Applicable source, tests, documentation, compatibility findings, prerequisite results, and residual limitations agree under their owning contracts.",
    "Administrative closeout records actual results and leaves automatic successor activation disabled."
  ],
  "exclusions": [
    "The current planning phase creates no implementation, dependency change, protected execution, scientific acceptance, publication, release, or automatic successor activation.",
    "Do not move behavior outside this Task concern or use parent status, planning prose, reviewer agreement, or passing checks as prerequisite or authority facts.",
    "Do not fabricate historical WorkflowRun, calculator, validation, human-decision, or provenance state during migration."
  ],
  "intake_path": null,
  "archived_source": null
}
