{
  "schema_version": 3,
  "task_id": "harness.simplify-2.validation-retirement.integration-closeout",
  "title": "Integrate and close R2.7",
  "status": "completed",
  "status_detail": "completed after all required integration gates passed, one independent read-only review reported three findings, and the single bounded correction pass corrected path confinement, reconciled the baseline ownership-field contract, documented the public-facade dependency exception, and passed affected final verification",
  "parent_task_id": "harness.simplify-2.validation-retirement",
  "task_prerequisite_ids": [
    "harness.simplify-2.validation-retirement.legacy-route-retirement"
  ],
  "external_prerequisite_ids": [],
  "superseded_by_task_ids": [],
  "explicit_activation_required": false,
  "objective": "Synchronize current documentation, execute the complete R2.7 integration gates, obtain one independent read-only review, and close R2.7 without successor activation or human-acceptance claims.",
  "authority_reference_paths": [
    "AGENTS.md",
    "harness/reports/validation-retirement-inventory.json",
    "harness/tasks/harness.simplify-2.validation-retirement.json"
  ],
  "authorized_scope": [
    "Update current architecture, API, operational, and Task documentation without rewriting historical evidence.",
    "Run the exact focused and repository-wide software, harness, documentation, control, cleanup, dependency-lock, and Git gates required by the current human instruction.",
    "Launch exactly one durable read-only harness integration reviewer and permit the original writer at most one bounded correction pass for material findings."
  ],
  "completion_criteria": [
    "All required deterministic and external final gates pass on one exact candidate tree and one independent integration review is complete.",
    "R2.7 and this child are completed, `harness.simplify-2` is selected as coordinating parent without human acceptance, automatic successor activation remains disabled, and no successor is active.",
    "The final boundary is committed and pushed with HEAD equal to origin/dev and a clean working tree."
  ],
  "exclusions": [
    "Do not launch additional reviewers, perform more than one correction pass, rewrite historical evidence, activate a successor, or claim human acceptance.",
    "Do not add dependencies or lockfile changes, scientific or numerical work, protected execution, publication, or release work."
  ],
  "intake_path": null,
  "archived_source": null
}
